{
  "summary": "BoloBuddy mock run for hinglish_l1_001 accepted iskool as a prompt-configured variant for school.",
  "completed": true,
  "feedback": {
    "child_feedback": "Super effort! Tumne sentence kaafi clearly bola.",
    "adult_feedback": "The child completed 5/5 expected words. The school/iskool variant was accepted by prompt configuration. Fluency was confident with confidence 0.82. This is an educational assessment, not a clinical diagnosis.",
    "suggested_practice": [
      "Do one cheerful repeat and then try the next prompt."
    ],
    "should_suppress_child_feedback": false
  },
  "child_result": {
    "mode": "child",
    "feedback": "Super effort! Tumne sentence kaafi clearly bola.",
    "developmental_level": "confident",
    "show_raw_scores": false
  },
  "adult_report": {
    "mode": "adult",
    "expected_text": "Mera school bag ready hai.",
    "spoken_transcript": "mera iskool bag ready hai",
    "word_timeline": [
      {"reference": "mera", "spoken": "mera", "status": "matched"},
      {"reference": "school", "spoken": "iskool", "status": "variant"},
      {"reference": "bag", "spoken": "bag", "status": "matched"},
      {"reference": "ready", "spoken": "ready", "status": "matched"},
      {"reference": "hai", "spoken": "hai", "status": "matched"}
    ],
    "missed_words": [],
    "changed_words": [],
    "target_sounds": [
      {
        "issue_type": "good_attempt",
        "token": "school",
        "sound": "sk",
        "confidence": 0.78
      }
    ],
    "scores": {
      "word_accuracy": 1.0,
      "reference_completeness": 1.0,
      "phoneme_accuracy": 0.74,
      "fluency_score": 0.92,
      "audio_quality_score": 0.83,
      "overall_score": 0.88,
      "developmental_level": "shining"
    },
    "uncertainty": [
      "Optional parent note: school pronounced with a leading vowel can be a practice target if the curriculum asks for strict phonics."
    ],
    "needs_human_review": false
  },
  "full_report": {
    "title": "BoloBuddy Voice Assessment Report",
    "summary": "Educational observations from a Hinglish sentence-reading task.",
    "battery_id": "bolo_age_5_6_sentence_reasoning",
    "domains": {
      "speech_clarity": {"level": "comfortable", "score": 0.84},
      "phonological_awareness": {"level": "developing", "score": 0.74},
      "expressive_language": {"level": "comfortable", "score": 1.0}
    },
    "insights": [
      {
        "domain": "phonological_awareness",
        "label": "School/iskool sound pattern",
        "summary": "The configured school/iskool variant was accepted; strict phonics can practice /sk/ separately.",
        "confidence": 0.82,
        "severity": "practice"
      }
    ],
    "exercises": [
      {
        "skill": "School/iskool sound pattern",
        "activity": "Say school slowly three times, then use it in Mera school bag ready hai.",
        "mode": "home_practice",
        "priority": "medium"
      }
    ],
    "disclaimer": "This is an educational report, not an IQ test or clinical diagnosis."
  }
}
